{
  "schema_version": "7.0",
  "run_id": "87d811d0-ef83-4c25-8e2d-a6251f176a90",
  "workflow_run_id": "1d299308-90c5-4169-a0ae-b4efcfa22051",
  "session_id": "d5736457-e2b2-49b4-8b75-2c312f1885b3",
  "organization_id": "56de19d7-5552-459a-a089-01745da44be0",
  "learner_id": "465927ff-cbf5-4461-a81e-da565e9c7fcc",
  "agent_name": "example",
  "task_type": "example",
  "context_refs": [
    {
      "ref_type": "example",
      "ref_id": "example"
    }
  ],
  "constraints": {},
  "requested_at": "2026-07-31T12:00:00Z",
  "review_target": {
    "target_type": "resource",
    "target_id": "example",
    "payload": {},
    "evidence_bundle": {},
    "learner_snapshot": {
      "profile_snapshot_id": "fc0694af-5457-47a5-9962-bed776605ec1",
      "background": {},
      "learning_goals": [
        "example"
      ],
      "preferences": [
        "example"
      ],
      "mastery_items": [
        {
          "knowledge_node_id": "example",
          "mastery_score": 0.5,
          "confidence": 0.5,
          "evidence_refs": [
            {
              "evidence_id": "7511ef51-2916-429b-bcd5-d5b9357c4fc5",
              "knowledge_node_id": "example"
            }
          ]
        }
      ],
      "risk_flags": [
        "example"
      ]
    }
  },
  "review_policy": {}
}
